source,english_sentence,hindi_sentence
indic2012,Grade:United state of america,श्रेणी:संयुक्त राज्य अमेरिका
ted,"And I reflected, as I was watching her sell the dresses,","और मैं सोच रही थी, जैसे मैं जेन को कपडे"
ted,any more than you know what I'm seeing,जैसे आप को नहीं पता मैं क्या देख रहा हूँ
tides,"While natural insulin has proved to be both more economical and more effective , research by Dr Arthur Teuscher of Switzerland 's Berne University has shown that it is easier to detect signs of hypoglycemia -LRB- sharp fall in blood sugar levels -RRB- when taking natural insulin than in the case of synthetic insulin .",एक ओर जहां प्राकृतिक इंसुलिन ज्यादा सस्ता और प्रभावी साबित हा है वहीं स्विट्जरलौंड़ के बर्न यूनिवर्सिटी के ड़ॉ.आर्थर ट्युशर के अनुसंधान से पता चल है कि संश्लेषित के बजाए प्राकृतिक इंसुलिन लेने से हाइपोग्लीसीमिया ( रक्त शर्करा की मात्रा में तेजी से गिरावट ) का पता लगाना आसान होता है .
tides,"While some are undoubtedly Pallava , painted over the plaster ground laid over the coarse sandstone surface , which expedient was found necessary -LRB- as at Ajanta -RRB- to smoothen and protect the stone surface even at the outset , there are undeniable evidences of the renewal of the plaster and the paintings over them in subsequent periods .","जबकि कुछ चित्र निस्संदेह रूप से पल्लव हैं , जो बालुकाश्म की खुरदरी सतह पर किए गए पलस्तर पर चित्रित किए गए थे और जो उस आरंभिक काल में भी पथरीली सतह को चिकना बनाने और सुरक्षा के लिए उचित और आवश्यक ( जैसा कि अंजता में ) पाया गया था , फिर भी अनुवर्ती काल में पलस्तर और चित्रों के नवीनकरण के निस्संदिग़्ध साक्ष्य विद्यमान हैं ."
tides,"Second , they possess alleles in both sexes instead of only in the female .","दूसरा फर्क है , युग़्मविकल्पी जीन दोनों लिंग के व्यक़्तियों में होते हैं , केवल स्त्री में नहीं होते ."
ted,Okay. Great.,ठीक है।
indic2012,His elder brother Ajit Tendulkar encouraged him to play.,उनके बड़े भाई अजीत तेंडुलकर ने उन्हें खेलने के लिये प्रोत्साहित किया था।
ted,"And then when I did my book, Thinking In Pictures,",और फ़िर जब मैने अपनी किताब “थिंकिंग इन पिक्चर्स” लिखी
indic2012,It is capable of producing light within and outside the house for 3 to 4 hours per day.,यह घर के अन्दर व घर के बाहर प्रतिदिन ३ से ४ घंटे तक प्रकाश दे सकने में सक्षम है।
tides,"2.5 The police investigation was efficient and effective in tracing and arresting suspects , and gathering evidence ; but it failed to pursue the question whether the crime was racially aggravated .","2.5संदिग्ध व्यक्तियों का पता लगाने और उन्हें गिरफ़्तार करने , तथा सबूत जुटाने में पुलिस की जाँच कुशल और प्रभावी थी , लेकिन यह इस सवाल का जवाब पाने में असफल रही कि अपराध नस्लभेद से प्रेरित था |भाष्;"
ted,its own customized version of mythology.,अपनी समझ के अनुरूप पौराणिक गाथाओं के रूप में ।
ted,And if we have another eight billion,और अगर हमारे पास आठ अरब अतिरिक्त
indic2012,"This metropolis is formed be combination of Mumbai city, Mumbai suburban districts, Navi Mumbai (New Mumbai) and Thane.",यह महानगर मुंबई शहर मुंबई उपनगर जिलों एवं नवी मुंबई तथा ठाणे शहरों को मिलाकर बनता है।
tides,"At his palatial bungalow in Rakhra village near Patiala , Darshan Singh Dhaliwal basks in the glory he has earned in the US .",रमेश विनायक पटियाल के निकट राखड़ गांव में दर्शन सिंह धालीवाल की भव्य को ई अमेरिका में कमाई समृद्धि से सराबोर है .
ted,That's why a very common feeling when you're in a museum -,इसीलिये जब भी हम सन्ग्रहालय मे होते है तो हमे ऐसा लगता है -
tides,"It is The tree of I ' rtiyaga peculiar to this kind of tree that its branches send forth two species of twigs , some directed upward , as is the case with all other trees , and others directed downward like roots , but without leaves .","इस वृक्ष की यह विशेषता है कि इसकी शाखाओं से दो प्रकार की टहनियां निकलती हैं , कुछ ऊपर की ओर उठी रहती हैं-जो अन्य वृक्षों में होता है-और कुछ नीचे की ओर जड़ों की तरफ चली जाती हैं लेकिन उनमें पते नहीं होते ."
indic2012,"according to pakistan government,at this time only the foundation stone of pakistan was layed.",पाकिस्तानी सरकार के अनुसार इसी समय पाकिस्तान की नींव डाली गई थी ।
indic2012,"Many translations of Mahabharata are found in South Asia- Different versions of Mahabharata are found in Indonesia, Sri Lanka, Java island, Jakarta, Thailand, Tibet, Burma (Myanmar).",महाभारत के दक्षिण एशिया मे कई रूपान्तर मिलते हैं इण्डोनेशिया श्रीलंका जावा द्वीप जकार्ता थाइलैंड तिब्बत बर्मा (म्यान्मार) में महाभारत के भिन्न-भिन्न रूपान्तर मिलते हैं।
ted,that are found within the Indus Valley.,जो सिंधु घाटी में पाए गऐ हैं।
tides,"Further , the sacrifices differ in duration , so that only he could perform certain of them who lives a very long life ; and such long lives do no longer occur in this our age .",इन यज्ञों की अवधि भी भिन्न-भिन्न होती है जिससे केवल वही कुछ यज्ञों को कर सकता है जो दीर्घायु होता है और ऐसी लंबी आयु हमारे इस युग में होती नहीं है .
indic2012,Spirituality ramayana is known as first ramayana in the world,अध्यात्म रामायण को ही विश्व का सर्वप्रथम रामायण माना जाता है।
indic2012,Collections of Bachan best poems,बच्चन के श्रेष्ठ कविताओं का संकलन
tides,"This part called malasthana and padma bandha marks the top end of the shaft and the beginning of the capital which consists of moulded parts , a pitcher , lasuna or kalasa , placed over the padma bandha , a saucer-shaped part called tadi , a flattened , bulbous or cushion-shaped member over it called the kumbha carrying an inverted platter-shaped part , and a doucine moulding , called the pali -LRB- or padma when it is shaped to simulate an inverted lotus blossom with petals -RRB- which really forms the underside of a plank-like abacusthe phalaka .","यह भाग ' मारमास्थान ' कहलाता है और स्तंभ का शिरोभाग ' पद्मबंध ' और शीर्षाभ के आरंभ का संकेत करता है , जिसमें ढले हुए भाग होते हैं , यथा पद्मबंध के ऊपर एक घट , लसुन या कलश , एक तश्तरी के आकार का भाग जिसे ताड़ी कहा जाता है , उसके ऊपर चपटे कंद के आकार का एक कुभं होता है जिस पर ' उल्टी कठौती ' का आकार बना होता है और एक पाली ( या पद्म जब उसका आकार पंखुरियों सहित विलोम कमल के प्रस्फूटन के समान हो ) जो वास्तव में एक तख़्ते के समान शीर्ष-फलक का भीतरी भाग बनता है ."
indic2012,She had close friendship with Subhadra Kumari Chowhan in the college.,कालेज में सुभद्रा कुमारी चौहान के साथ उनकी घनिष्ठ मित्रता हो गई।
ted,a nice round shape.,एक सुंदर गोल सा आकार.
indic2012,At the time of Shah Alum second whole royal palace was used to gate decorated with lamps and both Hindus-Muslims were used to participate in programs organized in Red fort.,शाह आलम द्वितीय के समय में समूचे शाही महल को दीपों से सजाया जाता था एवं लालकिले में आयोजित कार्यक्रमों में हिन्दू-मुसलमान दोनों भाग लेते थे।
tides,"If it is intended to establish a poultry farm for the production of table eggs , it should be stocked with chickens possessing high laying qualities .",यदि खाने के काम आने वाले अण्डों के उत्पादन के लिए मुर्गीपालन केन्द्र खोले जाने का विचार हो तो इसमें चूजे रखे जाने चाहिएं जिनमें अधिक अण्डे देने का गुण हो .
tides,RAMALINGA ' S YEARS IN MADRAS WERE MARKED BY GREAT literary activity .,मद्रास में रामलिंग का जीवन साहित्यिक गतिविधियों का रहा .
indic2012,Here the delta is more famous for rice cultivation.,यह डेल्टा चावल की कृषि के लिए अधिक विख्यात है।
tides,The Income-Tax Department comes under the Finance Ministry which is supposed to be leading the movement for economic reform ; so why is it unable to prevent its officials from behaving with the arrogance they displayed when the state was in control of the “ commanding heights ” ?,"आयकर विभाग वित्त मंत्रालय के मातहत है , जिसके बारे में माना जाता है कि वह आर्थिक सुधार आंदोलन का अगुआ है.ऐसे में वह अपने अधिकारियों की हेकड़ीबाजी रोकने में असमर्थ क्यों है ?"
indic2012,United States of America is a federal republic situated on the north American continent.,संयुक्त राज्य अमेरिका उत्तर अमेरिकी महाद्वीप पर स्थित एक संघीय गणतंत्र है।
ted,And you're terrified about the humiliation,और आप अपमान के बारे में डर रहे हैं
ted,and then every patient gets their teleconsultation with a doctor.,इस तरह हर रोगी को नेत्र-विशेषज्ञ से सीधे जोडा जा सका।
indic2012,"'Maya' is the maid of God, but lord of the Humans",माया ईश्वर की दासी है परन्तु हम जीवों की स्वामिनी है।
indic2012,Division of Mahabharata in 18 parts and 100 subparts.,महाभारत का १८ पर्वो और १०० उपपर्वो में विभाग
indic2012,Although royal historians put it in this way that Akbar was against sati practice and gave shelter to those helpless women.,हालांकि इस प्रकरण को दरबारी इतिहासकारों ने कुछ इस ढंग से कहा है कि इस प्रकार बादशाह सलामत ने सती प्रथा का विरोध किया व उन अबला स्त्रियों को संरक्षण दिया।
tides,"And even if there is no eclipse at such a time , it is considered quite as propitious as the time of an eclipse itself .",और यदि ऐसे समय में ग्रहण न भी हो तो भी उसे बहुत शुभ माना जाता है .
ted,"She believes, “Yes, this is it, this is what my destiny is about.”","वो मानती है “हाँ, अब यही है, यही मेरा भाग्य है.”"
tides,She blushed with shame .,भिखारिन शर्म से गड़ जातीहै .
indic2012,Series:- Honured by Nobel Price,श्रेणी:नोबेल पुरस्कार सम्मानित
tides,Acid rain is thus created by industrial activities that pollute the air .,इस तरह यह साबित हो जाता है कि अम्लीय वर्षा उन औद्योगिक गतिविधियों से होती है जो वायु को प्रदूषित करती हैं .
indic2012,Article 262 give authority to Parliament that to pass laws like State Water Dispute Act or to make an authorized body of Water Board for resolving arguments between two states of the country.,अनु 262 संसद को अधिकार देता है कि वह अंतराज्य जल विवाद को सुलझाने हेतु विधि का निर्माण करे संसद ने अंतराज्य जल विवाद तथा बोर्ड एक्ट पारित किये थे
indic2012,"Subhash Chandra bose, who was the most determined and resoureceful Indian enemy, marched.",सुभाषचंद्र बोस जो उनके सबसे अधिक दृढ़ संकल्प और संसाधन वाले भारतीय शत्रु थे ने कूच कर दिया था।
ted,Why can I not remove this confine,क्यों न मैं इस कैद को हटा दूँ
tides,"For early detection of the actual disease , angiography is considered the “ golden standard . ”",वास्तविक बीमारी का समय रहते ही पता लगाने के लिए एंजियोग्राफी को ' स्वर्ण मानक ' माना जाता है .
tides,The very idea of nationhood had completely disappeared .,राष्ट्रीयता का विचार ही पूरी तरह गायब हो गया था .
tides,There is often a small cistern or pit cut into the floor of the sanctum below the projected channel- spout on the top of the linga-pitha or image pedestal to receive and collect the abhisheka water .,"गर्भगृह के फर्श में , लिंग पीठ के ऊपर की प्रक्षिप्त नाली के मुंह के नीचे प्राय : एक कुंड है जिसमें अभिषेक का जल बहकर आता और इकट्ठा होता है ."
tides,Her renunciation of him releases Sachish not only from her spell but from his obsession with a religious pursuit that was little better than an escape .,उसका आत्मोत्सर्ग सचीश को न केवल उसके मोहजाल से बल्कि उस धार्मिक आश्रय के सम्मोहन से भी मुक्त करताहै- जिसे किसीपलायन से थोड़ा ही बेहतर कहा जा सकता है .
ted,"If you have democracy,","अगर लोकतंत्र है,"
tides,Goat 's milk is highly wholesome and nourishing .,बकरी का दूध अत्यन्त स्वास्थ्यप्रद और पौष्टिक होता है .
indic2012,history,इतिहास
tides,"If they want such a face , they have not come to me .",यदि उन्हें जंरी चेहरा चाहिए तो वो अभी तक तो मेरे पास नहीं आए हैं .
ted,"And you need a strong government to do that,","और इसके लिये आपको एक ताकतवर सरकार की ज़रूरत है,"
tides,"Normally once issues are conclusively settled at a parliamentary standing committee , it is not changed .",किसी स्थायी संसदीय समिति में एक मुद्दे पर कोई राय बन जाने के बाद आम तौर पर उसे बदल नहीं जाता .
tides,"Pack some supplies in the handbag or hand luggage , in case one gets separated from suitcase .",इन दवाइयों की कुछ मात्रा हाथ में ले जाये जाने वाले सामान में अलग से रखें ताकि सूटकेस साथ न होने पर भी कोई असुविधा न हो .
ted,"in that world, media is less and less often","उस दुनिया में, मीडिया कम से कम"
tides,"When Banita looked at the older woman , she could not help but remember with bitterness that dark day in July 1985 when Phanas-despairing of an extra mouth to feed in poverty-stricken Kalahandi-had sold her to the half-blind , penurious Bidyadhar for Rs 40 , just enough for her to buy 3 kg of rice and a sari .",उस बूढी औरत को देखते ही बनिता को जुलई 1985 का वह काल दिन तल्खी से याद हो आया जब गरीबी के मारे कालहांड़ी जिले में फनस ने घर की अतिरिक्त सदस्य का पेट भरने की घोर हताशा में उसे निपट दरिद्र व आधे दृष्टिहीन बिद्याधर के हाथों 40 रु.में बेच दिया था.यह राशि मात्र 3 किल चावल खरीदने भर को ही काफी थी .
ted,How they maintain them?,वे इसे कैसे बनाए रखते हैं?
indic2012,"State 33 district councils, 235 village panchayat Samithia and 9125 are Panchayte",राज्य में ३३ जिला परिषदें २३५ पंचायत समितियां और ९१२५ ग्राम पंचायतें हैं।
indic2012,"This Ishwar is called Allah (in Arabic) for Muslims, Khuda (in Parsi), for Christians (in English) God, and Jews (in Hebrew) Jehovah.",इसी ईश्वर को मुसल्मान (अरबी में) अल्लाह (फ़ारसी में) ख़ुदा ईसाई (अंग्रेज़ी में) गॉड और यहूदी (इब्रानी में) याह्वेह कहते हैं।
tides,"The divers The divers in our ponds , lakes and tanks include many diverse insects .","गोताखोर हमारे तालाबों , झीलों और टंकियों में विविध प्रकार के गोताखोर कीट पाए जाते हैं ."
tides,It is believed that quite a number of Jarawas are killed by the Bush police in the process .,ऐसा विश्वास किया जाता है कि इस प्रकार कुछ जरावा बुश पुलिस द्वारा अवश्य मारे जाते हैं .
tides,The Maharshi was enchanted and sat down for his evening meditation under a pair of chhatim trees .,महर्षि जैसे मोहित हो उठे और संध्या-वंदन के लिए धातिम वृक्ष के जोड़े के नीचे बैठ गए .
ted,to the enactment of PIPA and SOPA,पिपा और सोपा के कानून बनने से
tides,"DNA Damage and Repair Theory : We all use a cycle , or a motorbike or a car to commute from one place to another .","डी एन ए क्षति एवं प्रतिपूर्ति सिद्धांत : हम सब एक स्थान से दूसरे स्थान पर जाने के लिए साइकिल , मोटरसाइकल , कार , या अन्य वाहनों का प्रयोग करते हैं ."
indic2012,Musharraf could break up without a change of political leadership.,1. श्रीकृष्ण-साहित्य का मुख्य विषय कृष्ण की लीलाओं का गान करना है।
ted,"Most of the time,","अधिकांश समय,"
indic2012,"Dial-up connection, connection that connects one computer to another computer which has internet link, via modem , on the standard phone line is termed as dial-up connection.",डायल-अप कनेक्शन एक कम्प्यूटर से मोडेम द्वारा इंटरनेट से जुडे किसी अन्य कम्प्यूटर से स्टेण्डर्ड फोन लाइन पर कनेक्शन को डायल अप कनेक्शन कहते है।
ted,And we rely on others. We rely on proxies.,और हम दूसरों पे निर्भर रहते हैं | हम प्रतिनिधि पे भरोसा करते हैं |
indic2012,"Hindi ASR- Hindi (ASR) open source, It changes Hindi speechs into texts.",हिन्दी एऍसआर - हिन्दी (एऍसआर) मुक्तस्रोत यह हिन्दी के वाक् (स्पीच) को पहचानकर चैक्स्ट में बदलता है।
tides,"In many developed countries there is an internal system that ensures the brightest is not left behind-in Britain , for instance .","भत-से विकसित देशों , मसलन ब्रिटेन में आंतरिक व्यवस्था ही इस तरह की है कि प्रतिभाशाली व्यैक्त पीछे नहीं छूट सकता ."
tides,The answers to these questions are not too difficult to guess .,इन सवालों के जवाब का अनुमान लगाना कठिन नहीं है .
ted,to the policymakers.,नीति निर्माताओं तक.
indic2012,"In Europe while taking care of his health, Subhashbabu kept on persuing his task,",यूरोप में सुभाषबाबू ने अपनी सेहत का ख्याल रखते समय अपना कार्य जारी रखा।
